{
  "$comment": "GENERATED by contracts/codegen/generate.py from footage_reference.schema.yaml - DO NOT EDIT.",
  "$schema": "https://json-schema.org/draft/2020-12/schema",
  "additionalProperties": true,
  "description": "An episode's byte-lifecycle (on_card\u2192\u2026\u2192purged) + the spot-check held-purge fields \u2014 CONTRACT \u00a73.1, A-2.",
  "properties": {
    "episode_id": {
      "description": "The episode whose bytes these are (the key; one footage_reference per episode, A-2).",
      "minLength": 1,
      "type": "string"
    },
    "footage_state": {
      "description": "The byte lifecycle (domain-closed hard enum; `purged` per CONTRACT \u00a73). Safe-to-purge once on_hades verified.",
      "enum": [
        "on_card",
        "on_styx",
        "shipped",
        "on_hades",
        "purged"
      ],
      "type": "string"
    },
    "hash": {
      "description": "Optional content hash (transfer-integrity, deferred \u00a78).",
      "type": [
        "string",
        "null"
      ]
    },
    "locations": {
      "description": "Current location(s) as tier:path strings (scalar array; structured per-location = STOP-and-flag, OQ-B).",
      "items": {
        "type": "string"
      },
      "type": "array"
    },
    "purge_eligible_at": {
      "description": "= max(rendered_on_hades_at, the N-day window) \u2014 earliest Styx purge; watermark may bound it (OQ-5, values deferred).",
      "type": [
        "string",
        "null"
      ]
    },
    "rendered_on_hades_at": {
      "description": "When the single Hermes renderer produced the canonical artifact on Hades (OQ-5 held-purge input).",
      "type": [
        "string",
        "null"
      ]
    },
    "schema": {
      "description": "Schema identifier; additive semver (\u00a75).",
      "enum": [
        "eunomia-footage-reference/v1"
      ],
      "type": "string"
    },
    "selection_method": {
      "description": "WHY held \u2014 auto QC sample or a manual pull (domain-closed enum; OMITTED when not selected \u2014 absent, not null, OQ-5).",
      "enum": [
        "qc_sample",
        "manual_pull"
      ],
      "type": "string"
    },
    "spot_check_selected": {
      "description": "Selected for the fast-feedback spot-check (delays the purge; OQ-5). Requires selection_method (OQ-11).",
      "type": "boolean"
    }
  },
  "required": [
    "schema",
    "episode_id",
    "footage_state"
  ],
  "title": "FootageReference",
  "type": "object"
}
